{
  "id": "people",
  "name": "People",
  "description": "Employee directory with roles, skills, and system access",
  "aliases": ["employees", "staff", "team"],
  "config": {
    "purpose": "Track employee information, skills, and organizational relationships",
    "primaryKeys": ["id", "email"],
    "updateCadence": "Weekly from HR systems",
    "access": "All employees can view basic contact and role information",
    "requirements": {
      "requiredRecordFields": ["id", "name", "departmentId", "role", "email"],
      "requiredRelationshipFields": ["departmentId"],
      "notes": [
        "Each person must be associated with a valid department",
        "Skills should be standardized across the organization"
      ]
    },
    "orchestration": {
      "summary": "Employee directory for finding expertise and contact information",
      "signals": [
        "User asks about specific team members or roles",
        "Questions about who has particular skills or expertise",
        "Need to find contact information or organizational structure"
      ],
      "escalateWhen": [
        "Requests for sensitive HR information",
        "Person referenced doesn't exist in directory"
      ],
      "agents": {
        "userContextAgent": {
          "focus": "Explain people data structure and relationships",
          "signals": ["Questions about employee data schema or requirements"],
          "promptStarters": [
            "What fields are required for employee records?",
            "How do people relate to departments and applications?"
          ]
        },
        "databaseAgent": {
          "focus": "Search and filter employee information",
          "signals": ["Find employees by skills, department, or role"],
          "promptStarters": [
            "Find all engineers with React skills",
            "Who works in the marketing department?"
          ]
        },
        "dataAgent": {
          "focus": "Analyze and summarize people data",
          "signals": ["Generate reports about team composition or skills"],
          "promptStarters": [
            "Summarize the engineering team's skill coverage",
            "Create an organizational chart"
          ]
        }
      }
    }
  }
}
